message,rpid_str,parent,ctime,like,mid,sex
哟西是日本人，喜欢很正常,212354924784,0,1710417343,0,1742251,保密
悟空可是小孩性格，对人友善，对对手高度认可的。好胜心极强，对于武术可以说是痴迷，很自律没事就修行锻炼。,212171277072,0,1710307337,0,2087668933,保密
说这话你应该没看完龙珠Z，龙珠z后面悟空越来越成熟了好不好，比你的鸣人路飞成熟的多,212367015696,212171277072,1710422614,0,1895874701,保密
梅西事件到底是怎么回事，现在有人出来解释吗？是合同没谈好还是违约也不上。那他拿钱任性也是一种权利，没谈好那也不完全怪梅西。到底是怎么回事有人出来解释一下吗？,212153867072,0,1710299398,1,1972051050,保密
纯粹的媒体炒作，舆论就一边倒了，八月份开始传出梅喉王感觉就已经开始了，现在一波节奏让梅西在中国市场干碎了。还是不要跟风的好,212247772912,212153867072,1710343392,0,1050353436,保密
回复 @绪山小剑 : 终于有愿意说真话的了，说实话国籍什么的根本无所谓，只要是梅西我永远支持，我们喜欢梅西只谈球技，不讲人品。梅西也是人，他对中国讨厌又如何？就算他讨厌中国我也依然喜欢他，粉了是多年了，梅西是永远的球王！,212331754064,212247772912,1710407002,0,3494360312186997,男
回复 @奶香小雪糕 :关键这就不是人品的问题，其中一大堆利益问题不说，只讲这些表面。而网友就是这样的，跟风太多了。,212336795088,212331754064,1710409528,0,1050353436,保密
回复 @绪山小剑 : 无所谓，哪怕梅西对外是装出来的，哪怕他讨厌中国人，我也会依然喜欢他，他才是真正的球王,212341412912,212336795088,1710411567,0,3494360312186997,男
